{
    "bodyTypeName": "female",
    "url": "https://sanderfrenken.github.io/Universal-LPC-Spritesheet-Character-Generator/#?body=Body_color_brown&head=Human_male_brown&sex=female&shadow=none&wound_arm=none&wound_brain=none&wings=none&tail=none&hair=Sara_rose&hat=Magic_moon&legs=Pants_blue&cape=Solid_blue&arms=none&bauldron=none&shoes=Boots_black&wound_mouth=none&weapon=Staff_simple_staff&beard=Beard_white&dress=Sash_dress_blue&wrinkes=Wrinkles_brown",
    "spritesheets": "https://sanderfrenken.github.io/Universal-LPC-Spritesheet-Character-Generator/spritesheets/",
    "version": 1,
    "datetime": "10/12/2023, 08:39:12",
    "credits": "Authors: Benjamin K. Smith (BenCreating), bluecarrot16, TheraHedwig, Evert, MuffinElZangano, Durrani, Pierre Vigier (pvigier), ElizaWy, Matthew Krohn (makrohn), Johannes Sjölund (wulax), Stephen Challener (Redshrike), William.Thompsonj, Mandi Paugh, Michael Whitlock (bigbeargames), Tracy, Thane Brimhall (pennomi), laetissima, David Conway Jr. (JaidynReiman), Nila122, Joe White, Dr. Jamgo\n\n- body/bodies/female/universal/brown.png: by Benjamin K. Smith (BenCreating), bluecarrot16, TheraHedwig, Evert, MuffinElZangano, Durrani, Pierre Vigier (pvigier), ElizaWy, Matthew Krohn (makrohn), Johannes Sjölund (wulax), Stephen Challener (Redshrike). License(s): OGA-BY 3.0, CC-BY-SA 3.0, GPL 3.0. \n    - https://opengameart.org/content/liberated-pixel-cup-lpc-base-assets-sprites-map-tiles\n    - https://opengameart.org/content/lpc-medieval-fantasy-character-sprites\n    - https://opengameart.org/content/lpc-ladies\n    - https://opengameart.org/content/lpc-7-womens-shirts\n    - https://opengameart.org/content/lpc-jump-expanded\n\n- head/heads/human_male/universal/brown.png: by bluecarrot16, Benjamin K. Smith (BenCreating), Stephen Challener (Redshrike). License(s): OGA-BY 3.0, CC-BY-SA 3.0, GPL 3.0. \n    - https://opengameart.org/content/liberated-pixel-cup-lpc-base-assets-sprites-map-tiles\n    - https://opengameart.org/content/lpc-character-bases\n\n- head/wrinkles/brown.png: by bluecarrot16. License(s): CC0. \n\n- hair/sara/female/rose.png: by Stephen Challener (Redshrike), William.Thompsonj, Mandi Paugh, bluecarrot16. License(s): OGA-BY 3.0, CC-BY 3.0. \n    - https://opengameart.org/content/lpc-sara\n    - https://opengameart.org/content/lpc-hair\n\n- hat/magic/male/moon.png: by Michael Whitlock (bigbeargames), Tracy. License(s): OGA-BY 3.0. \n    - https://opengameart.org/content/lpc-celestial-wizard-hats\n    - https://opengameart.org/content/merlins-hat\n\n- dress/sash/female/blue.png: by bluecarrot16, Thane Brimhall (pennomi), laetissima, Matthew Krohn (makrohn). License(s): CC-BY-SA 3.0, GPL 3.0. \n    - https://opengameart.org/content/lpc-2-characters\n\n- cape/solid/female/blue.png: by bluecarrot16, David Conway Jr. (JaidynReiman). License(s): CC-BY-SA 3.0, GPL 3.0. \n    - https://opengameart.org/content/lpc-curly-hair-elven-ears-white-cape-with-blue-trim-and-more\n    - https://opengameart.org/content/lpc-roman-armor\n    - http://opengameart.org/content/lpc-clothing-updates\n\n- cape/solid_behind/blue.png: by Nila122, David Conway Jr. (JaidynReiman). License(s): CC-BY-SA 3.0, GPL 3.0. \n    - https://opengameart.org/content/lpc-curly-hair-elven-ears-white-cape-with-blue-trim-and-more\n    - https://opengameart.org/content/lpc-roman-armor\n\n- legs/pants/female/blue.png: by bluecarrot16, David Conway Jr. (JaidynReiman), Joe White, Matthew Krohn (makrohn), Johannes Sjölund (wulax). License(s): GPL 3.0, CC-BY-SA 3.0. \n    - https://opengameart.org/content/liberated-pixel-cup-lpc-base-assets-sprites-map-tiles\n    - https://opengameart.org/content/lpc-medieval-fantasy-character-sprites\n    - http://opengameart.org/content/lpc-clothing-updates\n\n- feet/boots/female/black.png: by bluecarrot16, Nila122. License(s): OGA-BY 3.0, CC-BY-SA 3.0, GPL 2.0, GPL 3.0. \n    - https://opengameart.org/content/lpc-clothes-and-hair\n\n- weapon/magic/simple_staff/female/simple_staff.png: by Dr. Jamgo. License(s): CC0. \n    - https://opengameart.org/content/lpc-simple-staff",
    "layers": [
        {
            "fileName": "cape/solid_behind/blue.png",
            "zPos": 5,
            "parentName": "cape",
            "name": "Solid",
            "variant": "blue"
        },
        {
            "fileName": "body/bodies/female/universal/brown.png",
            "zPos": 10,
            "parentName": "body",
            "name": "Body color",
            "variant": "brown"
        },
        {
            "fileName": "legs/pants/female/blue.png",
            "zPos": 20,
            "parentName": "legs",
            "name": "Pants",
            "variant": "blue"
        },
        {
            "fileName": "feet/boots/female/black.png",
            "zPos": 25,
            "parentName": "shoes",
            "name": "Boots",
            "variant": "black"
        },
        {
            "fileName": "dress/sash/female/blue.png",
            "zPos": 30,
            "parentName": "dress",
            "name": "Sash dress",
            "variant": "blue"
        },
        {
            "fileName": "cape/solid/female/blue.png",
            "zPos": 85,
            "parentName": "cape",
            "name": "Solid",
            "variant": "blue"
        },
        {
            "fileName": "head/heads/human_male/universal/brown.png",
            "zPos": 100,
            "parentName": "head",
            "name": "Human male",
            "variant": "brown"
        },
        {
            "fileName": "head/wrinkles/brown.png",
            "zPos": 102,
            "parentName": "wrinkes",
            "name": "Wrinkles",
            "variant": "brown"
        },
        {
            "fileName": "hair/sara/female/rose.png",
            "zPos": 120,
            "parentName": "hair",
            "name": "Sara",
            "variant": "rose"
        },
        {
            "fileName": "hat/magic/male/moon.png",
            "zPos": 130,
            "parentName": "hat",
            "name": "Magic",
            "variant": "moon"
        },
        {
            "fileName": "weapon/magic/simple_staff/female/simple_staff.png",
            "zPos": 140,
            "parentName": "weapon",
            "name": "Staff",
            "variant": "simple staff"
        }
    ]
}